{"$schema":"https://json-schema.org/draft/2020-12/schema","additionalProperties":false,"properties":{"allowed_statuses":{"items":{"type":"string"},"type":"array"},"ci_tiers":{"type":"object"},"freshness_policy":{"type":"string"},"physical_evidence_counts":{"additionalProperties":false,"properties":{"channel_emulator":{"const":0},"conducted":{"const":0},"hwil":{"const":0},"ota":{"const":0},"paired_points":{"const":0},"recorded_field_failures":{"const":0},"searched_seconds":{"const":0}},"required":["conducted","channel_emulator","ota","hwil","recorded_field_failures","paired_points","searched_seconds"],"type":"object"},"required_registries":{"items":{"type":"string"},"type":"array"},"schema":{"const":"graphx.fhss.phase5-qualification-profile.v1"},"scope":{"const":"synthetic_and_software_only"},"trend_policy":{"type":"object"},"verdict_classes":{"items":{"type":"string"},"type":"array"},"version":{"const":1}},"required":["schema","version","scope","physical_evidence_counts","allowed_statuses","verdict_classes","required_registries","freshness_policy","ci_tiers","trend_policy"],"title":"FHSS Phase 5 qualification profile","type":"object"}
